{
  "axes": {
    "agentic_tool_use": {
      "evaluation_ids": [],
      "status": "unknown"
    },
    "arabic": {
      "evaluation_ids": [],
      "status": "unknown"
    },
    "coding": {
      "evaluation_ids": [],
      "status": "unknown"
    },
    "general_intelligence": {
      "evaluation_ids": [],
      "status": "unknown"
    },
    "instruction_following": {
      "evaluation_ids": [],
      "status": "unknown"
    },
    "knowledge": {
      "evaluation_ids": [],
      "status": "unknown"
    },
    "long_context": {
      "evaluation_ids": [],
      "status": "unknown"
    },
    "multilingual": {
      "evaluation_ids": [],
      "status": "unknown"
    },
    "multimodal": {
      "evaluation_ids": [],
      "status": "unknown"
    },
    "non_hallucination": {
      "evaluation_ids": [],
      "status": "unknown"
    },
    "professional_tasks": {
      "evaluation_ids": [],
      "status": "unknown"
    },
    "reasoning": {
      "evaluation_ids": [],
      "status": "unknown"
    },
    "safety_refusal_behavior": {
      "evaluation_ids": [],
      "status": "unknown"
    }
  },
  "evidence_status": "unknown",
  "high_quality_candidate": false,
  "high_quality_rationale": "no exact-match evaluation evidence",
  "model_id": "tinyllama-tinyllama-1-1b-chat-v1-0",
  "policy_id": "atlas-quality-policy",
  "policy_version": "0.6.0",
  "profile_id": "qp-v1-d0a3e6db28842a95e776ba915bae397535f3ccf6878c6fa957a5ca245e864d87",
  "quality_snapshot_version": "0.6.0",
  "schema_version": "0.6.0"
}
