{
  "axes": {
    "agentic_tool_use": {
      "evaluation_ids": [],
      "status": "unknown"
    },
    "arabic": {
      "evaluation_ids": [],
      "status": "unknown"
    },
    "coding": {
      "evaluation_ids": [],
      "status": "unknown"
    },
    "general_intelligence": {
      "evaluation_ids": [],
      "status": "unknown"
    },
    "instruction_following": {
      "evaluation_ids": [],
      "status": "unknown"
    },
    "knowledge": {
      "evaluation_ids": [],
      "status": "unknown"
    },
    "long_context": {
      "evaluation_ids": [],
      "status": "unknown"
    },
    "multilingual": {
      "evaluation_ids": [],
      "status": "unknown"
    },
    "multimodal": {
      "evaluation_ids": [],
      "status": "unknown"
    },
    "non_hallucination": {
      "evaluation_ids": [],
      "status": "unknown"
    },
    "professional_tasks": {
      "evaluation_ids": [],
      "status": "unknown"
    },
    "reasoning": {
      "evaluation_ids": [],
      "status": "unknown"
    },
    "safety_refusal_behavior": {
      "evaluation_ids": [],
      "status": "unknown"
    }
  },
  "evidence_status": "unknown",
  "high_quality_candidate": false,
  "high_quality_rationale": "no exact-match evaluation evidence",
  "model_id": "microsoft-phi-3-mini-4k-instruct",
  "policy_id": "atlas-quality-policy",
  "policy_version": "0.6.0",
  "profile_id": "qp-v1-7f0042542b780432b60526907fb691bce7bbaa5cdd52f35cd74c714c0ddc30fe",
  "quality_snapshot_version": "0.6.0",
  "schema_version": "0.6.0"
}
