{
  "axes": {
    "agentic_tool_use": {
      "evaluation_ids": [],
      "status": "unknown"
    },
    "arabic": {
      "evaluation_ids": [],
      "status": "unknown"
    },
    "coding": {
      "evaluation_ids": [],
      "status": "unknown"
    },
    "general_intelligence": {
      "evaluation_ids": [],
      "status": "unknown"
    },
    "instruction_following": {
      "evaluation_ids": [],
      "status": "unknown"
    },
    "knowledge": {
      "evaluation_ids": [],
      "status": "unknown"
    },
    "long_context": {
      "evaluation_ids": [],
      "status": "unknown"
    },
    "multilingual": {
      "evaluation_ids": [],
      "status": "unknown"
    },
    "multimodal": {
      "evaluation_ids": [],
      "status": "unknown"
    },
    "non_hallucination": {
      "evaluation_ids": [],
      "status": "unknown"
    },
    "professional_tasks": {
      "evaluation_ids": [],
      "status": "unknown"
    },
    "reasoning": {
      "evaluation_ids": [],
      "status": "unknown"
    },
    "safety_refusal_behavior": {
      "evaluation_ids": [],
      "status": "unknown"
    }
  },
  "evidence_status": "unknown",
  "high_quality_candidate": false,
  "high_quality_rationale": "no exact-match evaluation evidence",
  "model_id": "orenguteng-llama-3-1-8b-lexi-uncensored-gguf",
  "policy_id": "atlas-quality-policy",
  "policy_version": "0.6.0",
  "profile_id": "qp-v1-a943a690a2bf54a7299f72fcfd5c6515a5b960dad3fb69fc566fe39b03001ad0",
  "quality_snapshot_version": "0.6.0",
  "schema_version": "0.6.0"
}
