{
  "axes": {
    "agentic_tool_use": {
      "evaluation_ids": [],
      "status": "unknown"
    },
    "arabic": {
      "evaluation_ids": [],
      "status": "unknown"
    },
    "coding": {
      "evaluation_ids": [],
      "status": "unknown"
    },
    "general_intelligence": {
      "evaluation_ids": [],
      "status": "unknown"
    },
    "instruction_following": {
      "evaluation_ids": [],
      "status": "unknown"
    },
    "knowledge": {
      "evaluation_ids": [],
      "status": "unknown"
    },
    "long_context": {
      "evaluation_ids": [],
      "status": "unknown"
    },
    "multilingual": {
      "evaluation_ids": [],
      "status": "unknown"
    },
    "multimodal": {
      "evaluation_ids": [],
      "status": "unknown"
    },
    "non_hallucination": {
      "evaluation_ids": [],
      "status": "unknown"
    },
    "professional_tasks": {
      "evaluation_ids": [],
      "status": "unknown"
    },
    "reasoning": {
      "evaluation_ids": [],
      "status": "unknown"
    },
    "safety_refusal_behavior": {
      "evaluation_ids": [],
      "status": "unknown"
    }
  },
  "evidence_status": "publisher_only",
  "high_quality_candidate": false,
  "high_quality_rationale": "no capability axis has defensible evidence",
  "model_id": "prism-ml-ternary-bonsai-2-27b-gguf",
  "policy_id": "atlas-quality-policy",
  "policy_version": "0.6.0",
  "profile_id": "qp-v1-84fb51e9bce91be64c9b032dac2d543c636286c06bf04833964aa1f98e6a8749",
  "quality_snapshot_version": "0.6.0",
  "schema_version": "0.6.0"
}
